{
  "$schema":"https://json-schema.org/draft/2020-12/schema",
  "$id":"https://schemas.tinlance.com/tadl/capability/v1/capability.schema.json",
  "title":"TADL Capability v1","type":"object","additionalProperties":false,
  "required":["apiVersion","kind","metadata","risk","spec"],
  "properties":{
    "apiVersion":{"const":"tadl.tinlance.com/v1"},"kind":{"const":"Capability"},
    "metadata":{"type":"object","additionalProperties":false,"required":["name","version"],"properties":{"name":{"type":"string"},"version":{"type":"string","pattern":"^[0-9]+\\.[0-9]+\\.[0-9]+$"}}},
    "risk":{"type":"object","additionalProperties":false,"required":["class"],"properties":{"class":{"enum":["R0","R1","R2","R3","R4","R5"]}}},
    "spec":{"type":"object","additionalProperties":false,"required":["inputs","outputs","requires"],"properties":{
      "inputs":{"type":"object"},"outputs":{"type":"object"},
      "requires":{"type":"object","additionalProperties":false,"properties":{"authorizations":{"type":"array","items":{"type":"string"}},"tools":{"type":"array","items":{"type":"string"}},"approvals":{"type":"array","items":{"type":"string"}},"evidence":{"type":"array","items":{"type":"string"}}}},
      "evaluation":{"type":"object","additionalProperties":false,"properties":{"suite":{"type":"string"},"minimumScore":{"type":"number","minimum":0,"maximum":1}}}
    }}
  }
}
